{
  "envelope_version": "1.0",
  "run_id": "north-america-20261029-0604",
  "stage": "architecture",
  "from_agent": "project-lead",
  "to_agents": [
    "copywriter"
  ],
  "status": "approved",
  "revision": 1,
  "inputs_consumed": [
    {
      "artifact": "research doc 1R9BhIct1aQju8jsIjKzgXJpjtyd4skE3cuc9Qln5iUc"
    }
  ],
  "payload_type": "content_brief",
  "payload": {
    "url": "/destinations/north-america",
    "primary_keyword": "destination wedding in the usa",
    "secondary_keywords": [
      "best destination wedding locations in the us",
      "destination wedding locations usa",
      "california destination wedding",
      "canada destination wedding",
      "hawaii destination wedding",
      "las vegas wedding"
    ],
    "title_draft": "Destination Wedding USA | Hawaii, Canada | Wedded Wonderland",
    "meta_description_draft": "155 characters or fewer, no price promise",
    "h1": "Choose your wedding in the USA or Canada, from Maui to Lake Louise",
    "audience": [
      "intl-couple-europe-full-service",
      "au-couple-marrying-abroad",
      "intimate-destination-elopement",
      "discerning-skeptic"
    ],
    "intent": "commercial_investigation",
    "section_outline": [
      {
        "id": "s1-hero",
        "heading_intent": "Choose your wedding in the USA or Canada, from Maui to Lake Louise",
        "must_answer": [
          "first sentence carries destination wedding in the USA and Hawaii; celebrations line; router; buttons"
        ]
      },
      {
        "id": "b9-qualifier",
        "heading_intent": "B9 router: where, style, guest band incl. Just the two of you, month, family or adults-only",
        "must_answer": [
          "router fields"
        ]
      },
      {
        "id": "b8-proof-strip",
        "heading_intent": "B8 proof line",
        "must_answer": [
          "fallback until F-proof signed off"
        ]
      },
      {
        "id": "b16-spotlight",
        "heading_intent": "Picture your vows on a Maui beach, in Napa's vines or by Lake Louise",
        "must_answer": [
          "doc 6b"
        ]
      },
      {
        "id": "s2-places",
        "heading_intent": "Choose the United States or Canada, then a place",
        "must_answer": [
          "US card, Canada card, Latin America and Caribbean line"
        ]
      },
      {
        "id": "s3-compare",
        "heading_intent": "Compare the places couples ask about most",
        "must_answer": [
          "10-row table with style, best months, flights, legal steps by passport, fit"
        ]
      },
      {
        "id": "s4-questions",
        "heading_intent": "Start with the question you actually have",
        "must_answer": [
          "guide, how-to-plan, costs, legal, quiz"
        ]
      },
      {
        "id": "s5-real-weddings",
        "heading_intent": "See real weddings from Hawaii to Vancouver",
        "must_answer": [
          "6 cards"
        ]
      },
      {
        "id": "s6-celebrations",
        "heading_intent": "Celebrate more than a wedding in North America",
        "must_answer": [
          "proposals, honeymoon, vow renewal, milestone birthday, family gathering"
        ]
      },
      {
        "id": "s7-how-it-works",
        "heading_intent": "See how planning with us works",
        "must_answer": [
          "5 steps, one Privileges line"
        ]
      },
      {
        "id": "s8-ways-to-plan",
        "heading_intent": "Choose how you want to plan",
        "must_answer": [
          "Concierge, Marketplace, Studio"
        ]
      },
      {
        "id": "s9-articles",
        "heading_intent": "Read before you choose a place",
        "must_answer": [
          "6 articles, 2 trending"
        ]
      },
      {
        "id": "s10-faq",
        "heading_intent": "Get answers before you enquire",
        "must_answer": [
          "10 FAQs"
        ]
      },
      {
        "id": "s11-form",
        "heading_intent": "Tell us where you are thinking of going",
        "must_answer": [
          "form, destination North America"
        ]
      },
      {
        "id": "s12-regions",
        "heading_intent": "Explore other regions",
        "must_answer": [
          "other region hubs"
        ]
      }
    ],
    "questions_to_answer": [
      "doc section 7, 10 FAQs"
    ],
    "link_plan": {
      "must_link_to": [
        {
          "url": "/destinations",
          "anchor_options": [
            "descriptive"
          ]
        },
        {
          "url": "/destinations/latin-america-caribbean",
          "anchor_options": [
            "descriptive"
          ]
        },
        {
          "url": "/wonderland-concierge",
          "anchor_options": [
            "descriptive"
          ]
        },
        {
          "url": "/destinations/europe",
          "anchor_options": [
            "descriptive"
          ]
        }
      ],
      "should_receive_links_from": [
        "/top-10-proposal-destinations-in-usa",
        "/10-captivating-venues-in-the-usa-to-consider-for-your-destination-wedding"
      ],
      "max_internal_links": 40
    },
    "schema_types": [
      "CollectionPage",
      "ItemList",
      "TouristDestination",
      "Service",
      "BreadcrumbList",
      "FAQPage"
    ],
    "word_count_range": [
      1800,
      2800
    ]
  },
  "self_qa": {
    "checklist": "fast mode: brief built by project lead from doc section 4",
    "results": [
      {
        "check": "section plan copied from doc",
        "pass": true
      }
    ]
  },
  "assumptions": [
    "Word count range set by the project lead for a region hub"
  ],
  "open_questions": [],
  "confidence": 0.8,
  "timestamp": "2026-10-29T06:30:00Z"
}